create table t1 (x int) with system versioning engine innodb;
insert into t1 values (1);
select now(6) into @t1;
update t1 set x= 2;
select now(6) into @t2;
delete from t1;
set @vt1= concat("create view vt1 as select * from t1 for system_time as of timestamp '", @t1, "'");
prepare stmt from @vt1;
execute stmt;
drop prepare stmt;
set @vt2= concat("create view vt2 as select * from t1 for system_time as of timestamp '", @t2, "'");
prepare stmt from @vt2;
execute stmt;
drop prepare stmt;
select * from vt1 for system_time all;
x
1
select * from vt2 for system_time all;
x
2
select * from t1;
x
create or replace view vt1 as select * from t1;
show create view vt1;
View	Create View	character_set_client	collation_connection
vt1	CREATE ALGORITHM=UNDEFINED DEFINER=`root`@`localhost` SQL SECURITY DEFINER VIEW `vt1` AS select `t1`.`x` AS `x`,`t1`.`sys_trx_start` AS `_t1_sys_trx_start`,`t1`.`sys_trx_end` AS `_t1_sys_trx_end` from `t1` FOR SYSTEM_TIME ALL where `t1`.`sys_trx_end` = 18446744073709551615	latin1	latin1_swedish_ci
drop view vt1;
drop view vt2;
create view vt1 as select * from t1 for system_time all;
select * from vt1 for system_time all;
x
2
1
prepare stmt from 'select * from vt1 for system_time all';
execute stmt;
x
2
1
drop prepare stmt;
select * from vt1;
x
prepare stmt from 'select * from vt1';
execute stmt;
x
drop prepare stmt;
select * from t1 for system_time as of timestamp @t1;
x
1
select * from vt1 for system_time as of timestamp @t1;
x
1
prepare stmt from 'select * from vt1 for system_time as of timestamp @t1';
execute stmt;
x
1
drop prepare stmt;
create or replace view vt1 as select * from t1;
select * from vt1 for system_time all;
x
prepare stmt from 'select * from vt1 for system_time all';
execute stmt;
x
drop prepare stmt;
insert into vt1 values (3);
select * from t1;
x
3
select * from vt1;
x
3
select * from t1 for system_time all;
x
2
1
3
select * from vt1 for system_time all;
x
3
create or replace table t1 (x int) with system versioning;
insert into t1 values (1), (2);
set @t1=now(6);
delete from t1 where x=2;
set @t2=now(6);
delete from t1 where x=1;
set @t3=now(6);
set @tmp= concat("create or replace view vt1 as select * from t1 for system_time as of timestamp '", @t1, "'");
prepare stmt from @tmp;
execute stmt;
drop prepare stmt;
select * from vt1 for system_time all;
x
1
2
create or replace table t1 (x int) with system versioning;
create or replace view vt1(c) as select x from t1;
create or replace table t1 (a int) with system versioning;
create or replace table t2 (b int) with system versioning;
insert into t1 values (1);
insert into t2 values (2);
create or replace view vt12 as select * from t1 cross join t2;
select * from vt12;
a	b
1	2
create or replace view vt12 as select * from t1 for system_time as of timestamp '0-0-0' cross join t2;
select * from vt12;
a	b
create or replace view vt1 as select a as xander, t2.b, t2.sys_trx_end from t1 as baba123012345678912, t2 query for system_time timestamp between '0-0-0' and '2020-1-1';
Warnings:
Warning	4086	Auto generated alias for `baba123012345678912.sys_trx_start` is too long; using `sys_trx_start`.
show create view vt1;
View	Create View	character_set_client	collation_connection
vt1	CREATE ALGORITHM=UNDEFINED DEFINER=`root`@`localhost` SQL SECURITY DEFINER VIEW `vt1` AS select `baba123012345678912`.`a` AS `xander`,`t2`.`b` AS `b`,`t2`.`sys_trx_end` AS `sys_trx_end`,`baba123012345678912`.`sys_trx_start` AS `sys_trx_start`,`baba123012345678912`.`sys_trx_end` AS `_baba123012345678912_sys_trx_end`,`t2`.`sys_trx_start` AS `_t2_sys_trx_start` from (`t1` `baba123012345678912` FOR SYSTEM_TIME ALL join `t2` FOR SYSTEM_TIME ALL) where `baba123012345678912`.`sys_trx_end` >= '0-0-0' and `baba123012345678912`.`sys_trx_start` <= '2020-1-1' and `t2`.`sys_trx_end` >= '0-0-0' and `t2`.`sys_trx_start` <= '2020-1-1'	latin1	latin1_swedish_ci
create or replace view vt1 as select a as xander, t2.b, t2.sys_trx_start as stato from t1 as baba1230123456789123, t2 for system_time as of timestamp '0-0-0' query for system_time timestamp between '0-0-0' and '2020-1-1';
Warnings:
Warning	4086	Auto generated alias for `baba1230123456789123.sys_trx_start` is too long; using `sys_trx_start`.
Warning	4086	Auto generated alias for `baba1230123456789123.sys_trx_end` is too long; using `sys_trx_end`.
show create view vt1;
View	Create View	character_set_client	collation_connection
vt1	CREATE ALGORITHM=UNDEFINED DEFINER=`root`@`localhost` SQL SECURITY DEFINER VIEW `vt1` AS select `baba1230123456789123`.`a` AS `xander`,`t2`.`b` AS `b`,`t2`.`sys_trx_start` AS `stato`,`baba1230123456789123`.`sys_trx_start` AS `sys_trx_start`,`baba1230123456789123`.`sys_trx_end` AS `sys_trx_end`,`t2`.`sys_trx_end` AS `_t2_sys_trx_end` from (`t1` `baba1230123456789123` FOR SYSTEM_TIME ALL join `t2` FOR SYSTEM_TIME ALL) where `baba1230123456789123`.`sys_trx_end` >= '0-0-0' and `baba1230123456789123`.`sys_trx_start` <= '2020-1-1' and `t2`.`sys_trx_end` > '0-0-0' and `t2`.`sys_trx_start` <= '0-0-0'	latin1	latin1_swedish_ci
create or replace view vvt1 as select * from t1, t2, vt1;
ERROR HY000: Creating VIEW from versioned VIEW `vt1` is prohibited!
drop view vt1, vt12;
drop table t1, t2;
